{
  "schemaVersion": "1.0.0",
  "kind": "ComparisonRequest",
  "dataClass": "synthetic_fixture",
  "comparisonId": "eeeeeeee-eeee-4eee-8eee-eeeeeeeeeeee",
  "intent": "code_regression",
  "baseline": {
    "runId": "11111111-1111-4111-8111-111111111111",
    "manifestSha256": "1111111111111111111111111111111111111111111111111111111111111111"
  },
  "candidate": {
    "runId": "16161616-1616-4161-8161-161616161616",
    "manifestSha256": "ffffffffffffffffffffffffffffffffffffffffffffffffffffffffffffffff"
  }
}
