{
  "schemaVersion": "1.0.0",
  "kind": "ComparisonRequest",
  "dataClass": "synthetic_fixture",
  "comparisonId": "dddddddd-dddd-4ddd-8ddd-dddddddddddd",
  "intent": "resource_candidate",
  "baseline": {
    "runId": "88888888-8888-4888-8888-888888888888",
    "manifestSha256": "8888888888888888888888888888888888888888888888888888888888888888"
  },
  "candidate": {
    "runId": "99999999-9999-4999-8999-999999999999",
    "manifestSha256": "9999999999999999999999999999999999999999999999999999999999999999"
  },
  "declaredResourceChanges": [
    "cpuRequest",
    "memoryRequest",
    "memoryLimit"
  ]
}
